{
  "slug": "density",
  "title": "물체의 부피와 질량 (밀도)",
  "grade": "중2",
  "unit": "1단원_물질의특성",
  "summary": "크기가 다른 물체의 질량과 부피를 측정해 밀도를 계산, 크기와 무관하게 밀도가 일정한 물질의 특성임을 확인",
  "wiki": "실험_밀도_측정.md",
  "entryMode": "free",
  "maxPoints": 6,
  "xLabel": "부피", "xUnit": "cm³",
  "yLabel": "질량", "yUnit": "g",
  "xMaxHint": 20,
  "yMaxHint": 160,
  "trendline": "proportional",
  "note": "물체마다 부피가 달라 x 고정 불가 — 각 조가 서로 다른 물체의 (부피, 질량)을 자유 입력. 같은 물질이면 원점 지나는 직선 위에 모이고 기울기가 밀도."
}
