{
  "slug": "boyle_pv",
  "title": "기체의 압력과 부피 관계",
  "grade": "중1",
  "unit": "6단원_기체의성질",
  "summary": "주사기 속 공기를 압축하며 압력과 부피 측정\n온도가 일정할 때 부피는 압력에 반비례",
  "wiki": "실험_기체의_압력과_부피_관계.md",
  "entryMode": "free",
  "maxPoints": 5,
  "xLabel": "공기의 압력", "xUnit": "기압",
  "yLabel": "공기의 부피", "yUnit": "mL",
  "xMaxHint": 2.5,
  "yMaxHint": 45,
  "trendline": "inverse",
  "trendPower": 1,
  "note": "교과서 자료변환 축과 통일(가로=압력, 세로=부피). 부피를 40~20mL로 맞추며 압력을 읽어 (압력, 부피) 쌍을 입력. 반비례 추세선 y=a÷x. 압력계가 0기압부터면 측정값에 1기압을 더해 입력."
}
