{
  "slug": "lauric_heating",
  "title": "로르산을 가열할 때의 온도 변화",
  "grade": "중2",
  "unit": "1단원_물질의특성",
  "summary": "로르산을 가열하며 시간에 따라 온도를 측정, 융해 구간에서 열을 흡수하는 동안 온도가 일정(플래토)함을 확인",
  "wiki": "실험_녹는점과_끓는점_측정.md",
  "xLabel": "시간", "xUnit": "분",
  "yLabel": "온도", "yUnit": "℃",
  "xValues": [0, 1, 2, 3, 4, 5, 6],
  "trendline": "smooth",
  "yMaxHint": 70,
  "note": "시간 1분 간격은 제안값 (교과서 결과표는 양-녹는점 비교). 융해 구간(약 43.9℃)에서 온도가 일정한 플래토 — 냉각 곡선 앱과 대칭 비교 가능 (2026-07-10 결정)."
}
