{
  "slug": "spring_force",
  "title": "용수철의 탄성력 측정",
  "grade": "중1",
  "unit": "5단원_힘의작용",
  "summary": "용수철을 잡아당겨 늘어난 길이별 탄성력을 측정, 탄성력이 늘어난 길이에 비례함을 확인",
  "wiki": "실험_용수철의_탄성력_측정.md",
  "xLabel": "늘어난 길이", "xUnit": "cm",
  "yLabel": "탄성력의 크기", "yUnit": "N",
  "xValues": [5, 10, 15, 20],
  "trendline": "proportional",
  "yMaxHint": 10
}
