{
  "slug": "specific_heat",
  "title": "물과 식용유의 비열 비교",
  "grade": "중1",
  "unit": "3단원_열",
  "summary": "같은 양의 물과 식용유를 동시에 가열하며 온도 변화를 측정, 비열이 큰 물의 온도가 덜 오름을 확인",
  "wiki": "실험_비열_비교.md",
  "xLabel": "가열 시간", "xUnit": "분",
  "yLabel": "온도", "yUnit": "℃",
  "xValues": [0, 1, 2, 3, 4, 5],
  "ySeries": ["물", "식용유"],
  "trendline": "smooth",
  "yMaxHint": 70,
  "note": "제안값: 가열 시간 1분 간격. 한 그래프에 물(●)·식용유(○) 두 계열 입력 — 같은 열을 받아도 식용유의 온도가 더 빨리 오르는(비열이 작은) 기울기 차이를 보여줌."
}
